category_id,category,description
a2e3bb50,country,Learn rise water security early live.
510c1f8d,offer,Thus win tax politics give show role on.
59653e1d,push,Different growth beyond magazine.
818b662e,rest,Seven everything person two her.
0d3a7798,lawyer,Least space certainly.
604e8407,guess,Real bill physical pick prove your board.
c1a05487,society,City coach they forget join within rather their.
4353ba93,exist,Coach west statement model manager.
0a380311,administration,Account seat turn answer trip open reflect either.
420706a1,computer,Happen probably attention pick forward Congress team reveal.
99d00d36,city,Whether have feeling career government institution.
0ea03ba3,power,Back who thus all.
368bc3b6,art,Seven arm since training project turn event.
a96e679e,stay,Campaign list per degree reach difference worker.
606103cf,note,International number against garden.
3a0a5768,woman,Hand create single necessary name color.
9735f25b,artist,Tax nothing policy fine.
6320ce7d,hope,Prevent along none clear fear.
bf6b0c75,answer,Once blood become plant gun election him.
91a5d04b,often,Environment fact sell scientist audience.
